{
  "metrics_id": "public_metrics.v0.1",
  "session_count": 0,
  "completion_count": 0,
  "completion_rate": 0,
  "feedback_submit_count": 0,
  "safety_block_count": 0,
  "high_risk_trigger_count": 0,
  "api_failure_count": 0,
  "realtime_failure_count": 0,
  "share_report_count": 0,
  "member_interest_count": 0
}
